[
  {
    "date": "2026-03-26",
    "ticker": "VNRX",
    "theme": "Nuclear / Next-Gen Energy",
    "conviction": "Strong Buy",
    "entry_price": 3.8,
    "analyst_target": 2.06,
    "implied_upside_at_entry": -45.79,
    "mktcap": 25933648.0,
    "vix_at_entry": 26.95,
    "yield_10y_at_entry": 4.39,
    "risk_on_at_entry": false,
    "signals": [
      "analyst_target",
      "analyst_upside",
      "insider_buys",
      "days_to_catalyst",
      "vol_ratio",
      "pct_above_52w_low",
      "pct_below_52w_high"
    ],
    "signal_values": {
      "analyst_target": 2.06,
      "analyst_upside": -45.79,
      "insider_buys": 18,
      "days_to_catalyst": 5,
      "vol_ratio": 16.7,
      "pct_above_52w_low": 12.5,
      "pct_below_52w_high": 79.6
    },
    "status": "Open",
    "cur_price": 0.19,
    "pct_chg": -95.04,
    "last_price_update": "2026-10-15 23:07 UTC",
    "report_url": "https://edwardphill.github.io/stockpicker/reports/VNRX-2026-03-26.html",
    "entry_timestamp": "2026-03-26 (time unknown)"
  },
  {
    "date": "2026-03-27",
    "ticker": "WVE",
    "theme": "Nuclear / Next-Gen Energy",
    "conviction": "Strong Buy",
    "entry_price": 6.2,
    "analyst_target": 28.8,
    "implied_upside_at_entry": 364.5,
    "mktcap": 1167180672.0,
    "vix_at_entry": 25.33,
    "yield_10y_at_entry": 4.33,
    "risk_on_at_entry": false,
    "signals": [
      "analyst_target",
      "analyst_upside",
      "insider_buys",
      "days_to_catalyst",
      "vol_ratio",
      "rev_accel",
      "pct_above_52w_low",
      "pct_below_52w_high"
    ],
    "signal_values": {
      "analyst_target": 28.8,
      "analyst_upside": 364.5,
      "insider_buys": 3,
      "days_to_catalyst": 41,
      "vol_ratio": 15.4,
      "rev_accel": 1.392,
      "pct_above_52w_low": 23.5,
      "pct_below_52w_high": 71.5
    },
    "status": "Open",
    "cur_price": 3.19,
    "pct_chg": -48.55,
    "last_price_update": "2026-10-15 23:07 UTC",
    "report_url": "https://edwardphill.github.io/stockpicker/reports/WVE-2026-03-27.html",
    "entry_timestamp": "2026-03-27 (time unknown)"
  },
  {
    "date": "2026-04-13",
    "entry_timestamp": "2026-04-13 21:56 UTC",
    "ticker": "MSFT",
    "theme": "Quantum / Emerging Tech",
    "conviction": "Strong Buy",
    "entry_price": 378.42,
    "analyst_target": 585.41,
    "implied_upside_at_entry": 54.7,
    "mktcap": 2812565520384.0,
    "vix_at_entry": 19.23,
    "yield_10y_at_entry": 4.31,
    "risk_on_at_entry": true,
    "signals": [
      "analyst_target",
      "analyst_upside",
      "insider_buys",
      "days_to_catalyst",
      "rev_accel",
      "pct_above_52w_low",
      "pct_below_52w_high"
    ],
    "signal_values": {
      "analyst_target": 585.41,
      "analyst_upside": 54.7,
      "insider_buys": 2,
      "days_to_catalyst": 16,
      "rev_accel": 0.079,
      "pct_above_52w_low": 6.4,
      "pct_below_52w_high": 31.9
    },
    "status": "Open",
    "cur_price": 539.44,
    "pct_chg": 42.55,
    "last_price_update": "2026-10-15 23:07 UTC",
    "report_url": "https://edwardphill.github.io/stockpicker/reports/MSFT-2026-04-13.html"
  },
  {
    "date": "2026-04-13",
    "entry_timestamp": "2026-04-13 22:09 UTC",
    "ticker": "ILMN",
    "theme": "Biotech / Life Sciences",
    "conviction": "Buy",
    "entry_price": 122.86,
    "analyst_target": 136.11,
    "implied_upside_at_entry": 10.8,
    "mktcap": 18786058240.0,
    "vix_at_entry": 19.23,
    "yield_10y_at_entry": 4.31,
    "risk_on_at_entry": true,
    "signals": [
      "analyst_target",
      "analyst_upside",
      "insider_buys",
      "days_to_catalyst",
      "rev_accel",
      "eps_growth",
      "fcf_yield",
      "pct_above_52w_low",
      "pct_below_52w_high",
      "rel_strength"
    ],
    "signal_values": {
      "analyst_target": 136.11,
      "analyst_upside": 10.8,
      "insider_buys": 4,
      "days_to_catalyst": 17,
      "rev_accel": 0.175,
      "eps_growth": 6.9,
      "fcf_yield": 4.2,
      "pct_above_52w_low": 75.9,
      "pct_below_52w_high": 21.0,
      "rel_strength": 35.3
    },
    "status": "Open",
    "cur_price": 267.93,
    "pct_chg": 118.08,
    "last_price_update": "2026-10-15 23:07 UTC",
    "report_url": "https://edwardphill.github.io/stockpicker/reports/ILMN-2026-04-13.html"
  },
  {
    "date": "2026-04-14",
    "entry_timestamp": "2026-04-14 09:57 UTC",
    "ticker": "HII",
    "theme": "Space / Satellite",
    "conviction": "Buy",
    "entry_price": 397.2,
    "analyst_target": 405.64,
    "implied_upside_at_entry": 2.1,
    "mktcap": 15640612864.0,
    "vix_at_entry": 19.12,
    "yield_10y_at_entry": 4.31,
    "risk_on_at_entry": true,
    "signals": [
      "analyst_target",
      "analyst_upside",
      "insider_buys",
      "days_to_catalyst",
      "rev_accel",
      "eps_growth",
      "fcf_yield",
      "pct_above_52w_low",
      "pct_below_52w_high",
      "rel_strength"
    ],
    "signal_values": {
      "analyst_target": 405.64,
      "analyst_upside": 2.1,
      "insider_buys": 1,
      "days_to_catalyst": 16,
      "rev_accel": 0.057,
      "eps_growth": 32.3,
      "fcf_yield": 4.4,
      "pct_above_52w_low": 87.8,
      "pct_below_52w_high": 13.7,
      "rel_strength": 32.1
    },
    "status": "Open",
    "cur_price": 267.22,
    "pct_chg": -32.72,
    "last_price_update": "2026-10-15 23:07 UTC",
    "report_url": "https://edwardphill.github.io/stockpicker/reports/HII-2026-04-14.html"
  },
  {
    "date": "2026-04-15",
    "entry_timestamp": "2026-04-15 00:24 UTC",
    "ticker": "QLYS",
    "theme": "Cybersecurity",
    "conviction": "Strong Buy",
    "entry_price": 83.22,
    "analyst_target": 133.33,
    "implied_upside_at_entry": 60.2,
    "mktcap": 2984128512.0,
    "vix_at_entry": 19.12,
    "yield_10y_at_entry": 4.3,
    "risk_on_at_entry": true,
    "signals": [
      "analyst_target",
      "analyst_upside",
      "insider_buys",
      "days_to_catalyst",
      "vol_ratio",
      "rev_accel",
      "eps_growth",
      "fcf_yield",
      "short_pct",
      "pct_above_52w_low",
      "pct_below_52w_high"
    ],
    "signal_values": {
      "analyst_target": 133.33,
      "analyst_upside": 60.2,
      "insider_buys": 1,
      "days_to_catalyst": 20,
      "vol_ratio": 1.6,
      "rev_accel": 0.087,
      "eps_growth": 43.6,
      "fcf_yield": 8.7,
      "short_pct": 12.0,
      "pct_above_52w_low": 11.7,
      "pct_below_52w_high": 46.5
    },
    "status": "Open",
    "cur_price": 192.65,
    "pct_chg": 131.49,
    "last_price_update": "2026-10-15 23:07 UTC",
    "report_url": "https://edwardphill.github.io/stockpicker/reports/QLYS-2026-04-15.html"
  },
  {
    "date": "2026-04-15",
    "entry_timestamp": "2026-04-15 15:17 UTC",
    "ticker": "IBM",
    "theme": "Quantum / Emerging Tech",
    "conviction": "Strong Buy",
    "entry_price": 240.27,
    "analyst_target": 307.48,
    "implied_upside_at_entry": 28.0,
    "mktcap": 225471561728.0,
    "vix_at_entry": 18.36,
    "yield_10y_at_entry": 4.3,
    "risk_on_at_entry": true,
    "signals": [
      "analyst_target",
      "analyst_upside",
      "insider_buys",
      "days_to_catalyst",
      "rev_accel",
      "eps_growth",
      "fcf_yield",
      "pct_above_52w_low",
      "pct_below_52w_high"
    ],
    "signal_values": {
      "analyst_target": 307.48,
      "analyst_upside": 28.0,
      "insider_buys": 5,
      "days_to_catalyst": 7,
      "rev_accel": 0.136,
      "eps_growth": 20.3,
      "fcf_yield": 5.8,
      "pct_above_52w_low": 8.9,
      "pct_below_52w_high": 26.0
    },
    "status": "Open",
    "cur_price": 234.12,
    "pct_chg": -2.56,
    "last_price_update": "2026-10-15 23:07 UTC",
    "report_url": "https://edwardphill.github.io/stockpicker/reports/IBM-2026-04-15.html"
  },
  {
    "date": "2026-04-15",
    "entry_timestamp": "2026-04-15 15:34 UTC",
    "ticker": "CGNX",
    "theme": "Industrial AI / Robotics",
    "conviction": "Buy",
    "entry_price": 55.58,
    "analyst_target": 65.6,
    "implied_upside_at_entry": 18.0,
    "mktcap": 9282630656.0,
    "vix_at_entry": 18.36,
    "yield_10y_at_entry": 4.26,
    "risk_on_at_entry": true,
    "signals": [
      "analyst_target",
      "analyst_upside",
      "insider_buys",
      "days_to_catalyst",
      "eps_growth",
      "fcf_yield",
      "pct_above_52w_low",
      "pct_below_52w_high",
      "rel_strength"
    ],
    "signal_values": {
      "analyst_target": 65.6,
      "analyst_upside": 18.0,
      "insider_buys": 2,
      "days_to_catalyst": 14,
      "eps_growth": 126.5,
      "fcf_yield": 2.1,
      "pct_above_52w_low": 143.2,
      "pct_below_52w_high": 7.2,
      "rel_strength": 16.8
    },
    "status": "Open",
    "cur_price": 55.67,
    "pct_chg": 0.16,
    "last_price_update": "2026-10-15 23:07 UTC",
    "report_url": "https://edwardphill.github.io/stockpicker/reports/CGNX-2026-04-15.html"
  },
  {
    "date": "2026-04-16",
    "entry_timestamp": "2026-04-16 10:12 UTC",
    "ticker": "TMDX",
    "theme": "Biotech / Life Sciences",
    "conviction": "Strong Buy",
    "entry_price": 110.98,
    "analyst_target": 155.0,
    "implied_upside_at_entry": 39.7,
    "mktcap": 3823002112.0,
    "vix_at_entry": 18.17,
    "yield_10y_at_entry": 4.26,
    "risk_on_at_entry": true,
    "signals": [
      "analyst_target",
      "analyst_upside",
      "insider_buys",
      "days_to_catalyst",
      "rev_accel",
      "fcf_yield",
      "squeeze_setup",
      "pct_above_52w_low",
      "pct_below_52w_high"
    ],
    "signal_values": {
      "analyst_target": 155.0,
      "analyst_upside": 39.7,
      "insider_buys": 2,
      "days_to_catalyst": 21,
      "rev_accel": 0.162,
      "fcf_yield": 2.5,
      "squeeze_setup": 41.5,
      "pct_above_52w_low": 31.3,
      "pct_below_52w_high": 28.9
    },
    "status": "Open",
    "cur_price": 76.52,
    "pct_chg": -31.05,
    "last_price_update": "2026-10-15 23:07 UTC",
    "report_url": "https://edwardphill.github.io/stockpicker/reports/TMDX-2026-04-16.html"
  },
  {